title,summary,date,categorys,content,url
Quốc hội đồng ý ‘giải cứu’ Vietnam Airlines,Quốc hội nhất trí với đề nghị của Chính phủ về các giải pháp tháo gỡ khó khăn cho Vietnam Airlines do ảnh hưởng của đại dịch Covid-19.,"Thứ ba, 17/11/2020 16:37 (GMT+7)",['Xã hội'],"Chiều 17/11, trước khi bế mạc, Quốc hội thông qua Nghị quyết Kỳ họp thứ 10, Quốc hội khóa XIV. Trong kỳ họp này, Quốc hội đã thông qua 7 luật, 13 nghị quyết và cho ý kiến về 4 dự án luật: Luật Giao thông đường bộ (sửa đổi); Luật Bảo đảm trật tự, an toàn giao thông đường bộ; Luật Lực lượng tham gia bảo vệ an ninh, trật tự ở cơ sở; Luật Phòng, chống ma túy (sửa đổi).  Ngoài ra, Quốc hội nhất trí với đề nghị của Chính phủ về các giải pháp tháo gỡ khó khăn cho Tổng công ty Hàng không Việt Nam (Vietnam Airlines) do ảnh hưởng của đại dịch Covid-19. Để thực hiện giải pháp này, Quốc hội cho phép Ngân hàng Nhà nước Việt Nam tái cấp vốn và gia hạn không quá 2 lần cho tổ chức tín dụng (không bao gồm các tổ chức tín dụng đang được kiểm soát đặc biệt) để cho Tổng công ty Hàng không Việt Nam vay bổ sung vốn phục vụ hoạt động sản xuất, kinh doanh.  Đồng thời, Quốc hội cho phép Vietnam Airlines chào bán thêm cổ phiếu cho cổ đông hiện hữu để tăng vốn điều lệ khi đáp ứng quy định. Chính phủ giao Tổng công ty Đầu tư và Kinh doanh vốn Nhà nước thay mặt Chính phủ đầu tư mua cổ phiếu tại Vietnam Airlines thuộc quyền mua cổ phần của cổ đông Nhà nước theo phương thức chuyển giao quyền mua; đồng thời, cho phép xác định việc đầu tư nêu trên thuộc dự án nhóm A. Cùng với đó là việc tăng cường công tác kiểm tra, kiểm toán, giám sát để việc tổ chức thực hiện bảo đảm đúng quy định. Tổng công ty Hàng không Việt Nam tiếp tục có giải pháp xử lý giảm lỗ, thực hiện có hiệu quả hoạt động sản xuất, kinh doanh và quan tâm đến quyền lợi người lao động trong điều kiện đại dịch Covid-19 có khả năng chưa thể sớm chấm dứt. Theo giải trình của Ủy ban Thường vụ Quốc hội về nội dung này, có ý kiến đề nghị ghi rõ 4.000 tỷ đồng cho Tổng công ty Hàng không Việt Nam vay bổ sung vốn phục vụ hoạt động sản xuất, kinh doanh.  Tuy nhiên, Ủy ban Thường vụ Quốc hội cho rằng vấn đề nêu trên thuộc thẩm quyền của Chính phủ, nên để Chính phủ chủ động trong việc tháo gỡ khó khăn cho Vietnam Airlines theo tình hình thực tế.  Ủy ban Thường vụ Quốc hội cũng thể hiện quan điểm để bảo đảm việc tổ chức thực hiện chặt chẽ, có hiệu quả, rất cần có quy định về công tác kiểm tra, kiểm toán, giám sát đối với vấn đề này. Theo Ủy ban Thường vụ Quốc hội, hiện, Tổng công ty Hàng không Việt Nam đang xây dựng Đề án cơ cấu lại để trình cấp có thẩm quyền phê duyệt. Mục tiêu của đề án nhằm xử lý giảm lỗ và phục hồi hoạt động sản xuất, kinh doanh. ",https://zingnews.vn/quoc-hoi-dong-y-giai-cuu-vietnam-airlines-post1153964.html
Vietnam Airlines dự kiến năm sau mỗi ngày lỗ vài chục tỷ đồng,"Lo ngại thị trường quốc tế chưa thể phục hồi, cạnh tranh giá vé đường bay nội địa gay gắt, lãnh đạo Vietnam Airlines dự báo mức lỗ năm 2021 của hãng ngang bằng 2020.","Thứ sáu, 6/11/2020 16:09 (GMT+7)","['Kinh doanh', 'Hàng không']","Tại Hội nghị xây dựng kế hoạch sản xuất kinh doanh năm 2021 của các tập đoàn, tổng công ty thuộc Ủy ban Quản lý vốn Nhà nước, ông Trịnh Hồng Quang, Phó tổng giám đốc Tổng công ty Hàng không Việt Nam (Vietnam Airlines), cho biết giá vé máy bay của các đường bay nội địa hiện ở mức quá rẻ, các đường bay quốc tế chưa biết khi nào mở lại…, nên hãng dự kiến tiếp tục gặp khó vào năm sau. Cụ thể, vị này cho hay ngành hàng không hiện vẫn gặp khó khăn do ảnh hưởng của đại dịch Covid-19; tất cả đường bay quốc tế chưa được thực hiện, chủ yếu vẫn là các chuyến hồi hương và chở hàng hoá. Mặc dù dịch bệnh ở Việt Nam đang được kiểm soát tốt, tuy nhiên, trên thế giới diễn biến vẫn phức tạp, nhiều quốc gia châu Mỹ, châu Âu dịch bệnh căng thẳng trở lại khiến nhiều nơi phải đóng cửa lần thứ hai. “Dự báo cho thấy Vietnam Airlines chưa có khả năng phục hồi đến hết tháng 10/2021”, ông Trịnh Hồng Quang cho biết. Khó khăn chồng khó khăn, ông Quang cho biết, để có mức lỗ nhỏ hơn 13.000 tỷ đồng năm 2020, trong suốt 10 tháng qua, Tổng công ty tập trung nhiều giải pháp tăng doanh thu, cắt giảm chi phí và liên tục làm việc với các chủ nợ để bàn cách giãn, hoãn các khoản thanh toán... Về phương hướng kinh doanh năm 2021, lãnh đạo Vietnam Airlines lo ngại tiếp tục khó khăn khi thị trường quốc tế chưa phục hồi, trong khi doanh thu thị trường quốc tế là chủ yếu đối với Vietnam Airlines. “Nếu thị trường này không phục hồi được thì chúng tôi vẫn tiếp tục khó khăn. Sang năm 2021, chúng tôi dự tính mỗi ngày vẫn lỗ vài chục tỷ đồng, mức lỗ sẽ ngang năm 2020. Vì thị trường nội địa có phục hồi nhưng giá vé vẫn thấp quá, thậm chí dưới 50% mức giá năm 2019 do các hãng đều dồn cả vào thị trường nội địa, giá cạnh tranh nhau từng đồng”, ông Quang nói. Lãnh đạo Vietnam Airlines cũng kiến nghị với Uỷ ban Quản lý vốn nhà nước tại doanh nghiệp (Ủy ban) hỗ trợ việc thực hiện các nội dung chỉ đạo tháo gỡ khó khăn, sớm có phương án tăng vốn điều lệ cho Vietnam Airlines để xử lý vấn đề dòng tiền đang rất khó khăn. “Các hãng hàng không trên thế giới nếu không có tài trợ từ Chính phủ thì đều đệ đơn phá sản. Chúng tôi kỳ vọng chủ trương hỗ trợ nhanh chóng được thực hiện”, Phó tổng giám đốc Vietnam Airlines nói. Ngoài ra, hãng cũng đề nghị Bộ GTVT, Cục Hàng không Việt Nam sớm có đánh giá tổng thể ngành hàng không hiện nay để có những quyết sách phù hợp, kịp thời, giúp ngành này đủ năng lực cạnh tranh với các hãng trên giới. Cụ thể, cần có giá trần, giảm khoản phí liên quan đến hoạt động ngành hàng không... Ghi nhận những kiến nghị của đại diện Vietnam Airlines, ông Nguyễn Ngọc Cảnh, Phó chủ tịch Ủy ban Quản lý vốn Nhà nước tại doanh nghiệp chia sẻ: “Ủy ban đã có văn bản báo cáo lên Chính phủ, và gửi các Bộ, ngành đề nghị các đơn vị phối hợp giải quyết các kiến nghị của Vietnam Airlines. Chúng tôi cũng nhìn nhận rằng năm 2021 các doanh nghiệp nói chung và doanh nghiệp hàng không nói riêng khó có thể phục hồi ngay được”. Theo báo cáo tài chính quý III/2020, Vietnam Airlines lỗ ròng 10.676 tỷ đồng trong 9 tháng đầu năm 2020. Mức thua lỗ này thổi bay thành quả tổng lợi nhuận 10.380 tỷ đồng của hãng trong 5 năm 2015-2019.",https://zingnews.vn/vietnam-airlines-du-kien-nam-sau-moi-ngay-lo-vai-chuc-ty-dong-post1150202.html
Cục Hàng không yêu cầu rà soát việc đưa đón khách tại Tân Sơn Nhất,Lãnh đạo Cục Hàng không chỉ đạo Cảng vụ Hàng không miền Nam rà soát hoạt động đón trả khách bằng ôtô tại sân bay Tân Sơn Nhất.,"Thứ ba, 17/11/2020 14:53 (GMT+7)",['Xã hội'],"Trao đổi với Zing sáng 17/11, Cục trưởng Cục Hàng không Đinh Việt Thắng cho biết đã chỉ đạo Cảng vụ Hàng không miền Nam rà soát, kiểm tra lại hoạt động phân làn, đón trả khách tại sân bay Tân Sơn Nhất. Trước đó, theo phản ánh của Zing, việc sắp xếp, bố trí lại hoạt động đưa đón hành khách bằng ôtô tại nhà ga quốc nội T1 đã đem lại nhiều điểm tích cực và cả bất cập. Theo quy định phân làn ôtô áp dụng từ ngày 14/11 tại sân bay Tân Sơn Nhất, làn A (khu vực sát nhà ga quốc nội) chỉ dành cho phương tiện đưa khách đi máy bay. Việc đón khách tại đây bị cấm. Hai làn tiếp theo B và C dành cho các phương tiện đón khách ngoại trừ xe taxi, xe kinh doanh vận tải. Làn D nằm trong nhà xe TCP chỉ dành cho xe taxi, xe kinh doanh vận tải đón khách. Riêng xe công nghệ phải di chuyển lên tầng 3-5 của nhà xe để đón khách. Trao đổi với Zing, đại diện Cảng hàng không Tân Sơn Nhất cho biết sau 3 ngày áp dụng quy định mới, tuyến đường chính dẫn vào nhà ga không còn cảnh ùn tắc, hành khách đi, đến sân bay bằng ôtô có thể tiếp cận sảnh nhà ga nhanh hơn. Thậm chí tại làn B, C còn rất vắng vẻ vì lượng xe cá nhân đưa đón khách không nhiều. Điểm bất cập là xe công nghệ (Grab Car, Be Car) với giá cước thường rẻ hơn taxi nhượng quyền, không còn được tiếp cận khách tại làn D nhà ga như các hãng taxi. Thay vào đó, các tài xế xe công nghệ phải đỗ xe từ tầng 3 đến tầng 5 của nhà để xe và đợi hành khách tự di chuyển lên. Về vấn đề này, đại diện sân bay thừa nhận vị trí làn D chỉ dành cho các hãng taxi nhượng quyền dừng đón trả khách. Các hãng này đã ký hợp đồng với sân bay nên phải được hưởng quyền lợi tương ứng. Trong hoàn cảnh cảng hàng không muốn bảo vệ quyền lợi cho các đối tác nhượng quyền, hành khách lại muốn tiếp cận dịch vụ vận chuyển giá rẻ... nhà chức trách hàng không có vai trò rà soát và điều chỉnh cho phù hợp. Theo Nghị định 102/2015 về quản lý, khai thác sân bay, Cảng vụ hàng không có trách nhiệm kiểm tra, giám sát trực tiếp việc cung cấp dịch vụ phi hàng không tại cảng hàng không, sân bay. Dịch vụ phi hàng không bao gồm cả việc cho thuê mặt bằng nhà ga để kinh doanh và dịch vụ ôtô đưa đón hành khách.",https://zingnews.vn/cuc-hang-khong-yeu-cau-ra-soat-viec-dua-don-khach-tai-tan-son-nhat-post1153893.html
Tài xế xe công nghệ ở sân bay Tân Sơn Nhất lo mất khách,"Sau quy định phân làn ôtô mới tại sân bay Tân Sơn Nhất, hành khách phải mất thêm thời gian di chuyển lên tầng 3-5 của nhà xe nếu muốn sử dụng xe công nghệ.","Thứ ba, 17/11/2020 05:00 (GMT+7)",['Kinh doanh'],"“Ai đi taxi, Grab, qua làn D bên trong này”, nhân viên cảng hàng không Tân Sơn Nhất liên tục hướng dẫn hành khách khi được hỏi về địa điểm đón xe. Hai ngày từ khi áp dụng quy định mới về phân làn ôtô ở sân bay Tân Sơn Nhất, nhiều hành khách vẫn chưa nắm rõ địa điểm đón xe. “Anh đang đứng ở cột số mấy? Giờ phí cộng thêm là 25.000 đồng chứ không phải 10.000 vì xe phải vào bãi đậu của sân bay. Nếu anh đồng ý phí này thì em sẽ qua chỗ anh dẫn anh đi”, ông Mỹ, tài xế xe công nghệ gọi khách.  Tài xế này chia sẻ nhiều hành khách ngại di chuyển lên tầng cao do mang vác hành lý nặng nên hủy chuyến sau khi đặt xe nên phải gọi thống nhất trước với khách mới chạy xe vào sân bay. Nếu không, tài xế sẽ mất phí 25.000 đồng khi vào nhà xe TCP.  ""Số lượng hủy chuyến khá nhiều. Tôi lo từ nay sẽ mất khách"", ông Mỹ nói. Đáp chuyến bay muộn từ Hà Nội về TP.HCM tối 15/11, chị Ngọc Anh bật ứng dụng Grab để đặt ôtô về nhà ở đường Nơ Trang Long (quận Bình Thạnh) và nhận được thông báo sử sử dụng thang máy lên tầng 3, 4 hoặc 5 để đón xe. Nhưng khi gọi cho tài xế, người này đang ở ngoài sân bay và vẫn chưa biết có thể đậu xe ở đâu.  Ứng dụng báo giá cước phí chuyến đi là 90.000 đồng. Chị Ngọc Anh đồng ý mức phí cộng thêm. Tuy nhiên, khi thấy cảnh nhiều hành khách xếp hàng chờ trước 2 thang máy của nhà xe TCP, chị hủy chuyến, chuyển sang bắt taxi vì không muốn chờ lâu. Nhưng quá trình bắt taxi cũng không hề nhanh. ""Nhiều tài xế Mai Linh, Vinasun từ chối tôi vì quãng đường ngắn 6 km, tương đương cước phí khoảng 100.000 đồng, không bõ công họ xếp hàng chờ vào sân bay"", chị kể lại. Sau gần 30 phút, một xế taxi đồng ý chở chị Ngọc Anh. Giá chuyến xe taxi có giá 110.000 đồng, đã bao gồm 10.000 phí vào sân bay. Con số này rẻ hơn tổng cước phí 115.000 đồng của cuốc xe công nghệ. ""Tôi thường đặt xe Grab, Be để tiết kiệm tiền. Nhưng nay so ra thì chi phí xe truyền thống có khi còn rẻ hơn, đặc biệt không phải xếp hàng đợi thang máy lên lầu"", chị đánh giá. Tại làn D bên trong nhà xe TCP, ngoài các hãng taxi, một số đơn vị vận tải có hợp đồng với phía sân bay như Avigo, Satsco, Sóng Việt được phép đón khách. Tuy nhiên, cước phí của các đơn vị xe hợp đồng này khá cao so với mặt bằng chung. Khi hỏi giá chuyến đi từ sân bay Tân Sơn Nhất về ngã tư Hàng Xanh (quận Bình Thạnh) chiều 16/11, phóng viên được nhân viên Satsco và Avigo báo giá cước là 220.000 đồng. Nhân viên cho biết đây là giá cố định, đã bao gồm chi phí bến, bãi.  Trong khi đó, giá của cùng cuốc xe này trên ứng dụng gọi xe công nghệ chỉ là 115.000 đồng, đã bao gồm 25.000 đồng phí đậu xe. Nếu sử dụng taxi, cước phí cho quãng đường khoảng 7 km này khoảng hơn 150.000 đồng, đã gồm phí 10.000 đồng vào sân bay. Chị Hoàng Nguyên (quận 1, TP.HCM), cho rằng việc di chuyển lên tầng 3-5 của nhà xe TCP để đón xe công nghệ bất tiện khi chỉ có 2 thang máy diện tích khá nhỏ. Nếu mang nhiều hành lý, hành khách sẽ vất vả nếu đi cầu thang bộ. Ngược lại, chị Hà Mai (ngụ quận 4), đánh giá việc phân làn mới của sân bay Tân Sơn Nhất là hợp lý, giúp tránh cảnh ùn tắc trước nhà ga quốc nội. Chị Mai cho biết tại một số sân bay ở nước ngoài chị từng đến, hành khách cũng phải đi xa để đón xe.  Hai hãng xe công nghệ Grab và Be đều khẳng định ủng hộ việc quy hoạch lại luồng xe ra vào sân bay Tân Sơn Nhất để tạo ra sự thông thoáng, trật tự và an toàn cho hành khách và đã chủ động truyền thông đến tài xế, hành khách. Tuy nhiên, đại diện hai ứng dụng này đều cho rằng quá trình thực hiện quy định phân làn mới còn một số bất cập, ảnh hưởng đến trải nghiệm dịch vụ với cả tài xế và khách hàng có nhu cầu sử dụng xe công nghệ.  “Thời gian đầu triển khai phân luồng sẽ gây khó khăn nhất định cho cả tài xế và khách hàng. Chúng tôi đang nỗ lực phối hợp cùng cơ quan chức năng và các bên liên quan để tìm giải pháp tốt nhất cho tài xế và khách hàng của ứng dụng trong thời gian tới”, đại diện Be cho biết. Phía Grab cũng bình luận tương tự.",https://zingnews.vn/tai-xe-xe-cong-nghe-o-san-bay-tan-son-nhat-lo-mat-khach-post1153680.html
Ngân hàng lại đồng loạt rao bán ôtô giá rẻ,"Hàng loạt ôtô dưới 9 chỗ đang được các ngân hàng rao bán với giá rẻ hơn thị trường. Đáng chú ý, nhiều xe hạng sang cũng được bán với giá thấp hơn vài trăm triệu đồng.","Thứ ba, 17/11/2020 19:33 (GMT+7)","['Kinh doanh', 'Tài chính']","Trong thông báo mới đây, ngân hàng BIDV Chi nhánh Hà Tây rao bán đấu giá 3 tài sản đảm bảo là ôtô (gồm Toyota Camry LE đen, sản xuất năm 2007; Toyota Camry 3.5Q đen, sản xuất năm 2009; và xe bán tải Toyota Hilux, sản xuất năm 2015). Tổng giá khởi điểm BIDV đưa ra cho lô tài sản này là 1,001 tỷ đồng. Đáng chú ý, trên thị trường xe cũ, những mẫu Toyota Camry LE đời 2017 vẫn được rao bán với giá trên 440 triệu đồng, trong khi giá bán Toyota Camry 3.5Q đời 2009 tại các xưởng xe cũ khu vực Hà Nội cũng ở mức trên dưới 570 triệu. Với dòng xe bán tải Toyota Hilux đời 2015, giá thị trường hiện dao động trong khoảng 420-450 triệu đồng. Như vậy, tổng giá thị trường của 3 chiếc xe đang được BIDV rao bán vào khoảng 1,4-1,5 tỷ đồng, cao hơn 40% so với giá khởi điểm mà ngân hàng đưa ra. Tương tự, Vietcombank mới đây cũng thông báo bán thanh lý ôtô Toyota Land Cruiser Prado sản xuất năm 2016 với giá khởi điểm 1,384 tỷ đồng, rẻ hơn 300 triệu so với xe cũ trên thị trường hiện nay. Thậm chí, nếu so với giá xe Toyota Land Cruiser Prado đời 2016 mới qua sử dụng, giá khởi điểm ngân hàng đưa ra thấp hơn gần 1 tỷ đồng.  Một trong những ngân hàng rao bán nhiều ôtô cũ nhất hiện nay là VIB, nhà băng này đang có danh sách xe hơi bán thanh lý hơn 30 chiếc, gồm nhiều thương hiệu khác nhau như từ Kia, Honda, Hyundai, Mazda, Chevrolet cho tới Mercedes Benz. Nhiều ôtô thanh lý tại nhà băng này đều là xe có giá trị lớn như Peugeot 3008 đời 2018; Hyundai Santafe đời 2019; Toyota Camry đời 2017; hay Mercedes Benz C300 đời 2017… Những mẫu xe này hiện có giá trên dưới 1 tỷ đồng trên thị trường xe cũ. Trong khi đó, phần lớn mẫu xe rao bán thanh lý tại VIB có giá thấp hơn thị trường 5-15%. Như chiếc Mercedes Ben C300 đời 2017 trên thị trường xe cũ có giá xấp xỉ 1,5 tỷ đồng, hiện được ngân hàng bán với giá khởi điểm 1,2 tỷ; xe Toyota Camry đời 2017 đã qua sử dụng có giá thị trường 850-900 triệu nhưng ngân hàng bán với giá 820 triệu đồng… Ngoài ra, hàng loạt mẫu xe hơi dưới 9 chỗ cũng đang được VIB thanh lý với giá từ 145 triệu như Chevrolet Spark Van đời 2016; Mitsubishi Attrage đời 2017, giá 235 triệu; Chevrolet Cruze đời 2017, giá 320 triệu; Honda City đời 2019, giá 485 triệu… Chủ một doanh nghiệp phân phối ôtô cũ tại Hà Nội cho biết gần đây các ngân hàng thanh lý rất nhiều xe cũ, là tài sản thế chấp của các khoản vay không còn khả năng trả nợ. Theo vị này, so với loại tài sản thế chấp là bất động sản, ôtô con có thanh khoản cao hơn nhiều, với các dòng xe năm sản xuất không quá sâu (sau năm 2014) ngân hàng chỉ mất 1-2 tháng đã có thể thanh lý. Trong khi đó, việc thanh lý tài sản là bất động sản, chung cư có thể kéo dài 1-2 năm vì vấn đề pháp lý, tranh chấp quyền sở hữu, quyền thừa kế… Ngoài ra, việc thu giữ tài sản đảm bảo là xe hơi của ngân hàng cũng thường không gặp bất kỳ tranh chấp pháp lý nào. “Với ôtô dưới 9 chỗ, tại thời điểm thu giữ, ngân hàng đã có thể thông báo bán thanh lý. Giá trị các dòng xe ngân hàng rao bán cũng không quá đắt nên người ngoài có thể dễ dàng tiếp cận”, chủ doanh nghiệp xe cũ nói trên chia sẻ. Tuy nhiên, hạn chế lớn nhất của việc mua xe cũ từ ngân hàng là không có chế độ hậu mãi so với việc mua tại các xưởng dịch vụ. Ngoài ra, người đứng bán (ngân hàng) và đại diện là các nhân viên ngân hàng thường không am hiểu về xe nên khó miêu tả chi tiết tình trạng máy móc thực tế cho người mua. Trường hợp xe phát sinh lỗi máy móc sau giao dịch, ngân hàng cũng không thể giải quyết cho người mua.",https://zingnews.vn/ngan-hang-lai-dong-loat-rao-ban-oto-gia-re-post1154019.html
